{
  "$schema": "../../schema/dd.schema.json",
  "schema_version": 1,
  "name": "vite-react-router",
  "entrypoint": "src/worker.ts",
  "config": {
    "public": true,
    "bindings": [
      {
        "type": "memory",
        "binding": "EXAMPLE_MEMORY"
      },
      {
        "type": "kv",
        "binding": "STORE_DB"
      }
    ]
  }
}
